<?xml version="1.0" encoding="utf-8" ?>
<!DOCTYPE mapper PUBLIC "-//noear.org//DTD Mapper 3.0//EN" "http://noear.org/dtd/waad-mapper.dtd">
<mapper namespace="waaddemo2.xmlsql2"
        import="waad_demo.mapper.*">
    <sql id="user_add" return="List[Long]"
         param="m:UserModel,sex:int"
         remarks="添加用户"
         cacheClear="user_${m.user_id}"><![CDATA[
        INSERT user(user_id,mobile,sex) VALUES(@{m.user_id},@{m.mobile},@{sex})
    ]]></sql>

    <sql id="user_add3" return="long"
         param="m:UserModel,sex:int"
         remarks="添加用户"
         cacheClear="user_${m.user_id}">
        INSERT user
        <trim prefix="(" suffix=")" trimEnd=",">
            user_id,sex,
            <if test="m.mobile??">
                mobile,
            </if>
        </trim>
        VALUES
        <trim prefix="(" suffix=")" trimEnd=",">
            @{m.user_id},${sex},
            <if test="m.mobile != null">
                @{m.mobile},
            </if>
        </trim>
    </sql>

    <sql id="user_add_for" return="long" remarks="批量添加用户3">
        INSERT user(id,mobile,sex) VALUES
        <for var="m:UserModel" sep="#" items="list">
            (@{m.user_id},@{m.mobile},@{m.sex})
        </for>
    </sql>


    <sql id="user_set" return="long" remarks="更新用户"><![CDATA[
        UPDATE user SET sex=1 WHERE id IN(@{user_list:List[Integer]})
    ]]></sql>

    <sql id="user_add_for2" return="long" remarks="批量添加用户3">
        INSERT user(id,mobile,sex) VALUES
        <for var="m:UserModel" items="list">
            <if test="m.users != null">
                <for var="m2:UserModel" items="m.users">
                    (@{m2.user_id},@{m2.mobile},@{m2.sex})
                </for>
            </if>
        </for>
    </sql>
</mapper>